Title,Year,Month,Day,Hour
how a polytechnic helps you make the tech-business connection,2021,6,16,17
machine learning vs ai business models – what’s new with the economics of ai?,2020,11,12,16
my videos for “business analytics using data mining” now publicly available!,2017,9,5,14
a tale of two (business analytics) courses,2013,11,5,6
data science book: profit driven business analytics,2018,5,28,19
going live to grow your business – an interview with lindy chapman,2020,9,4,13
monash business analytics team profile,2016,3,9,7
acems business analytics prize 2016,2016,1,20,5
questions on the business analytics jobs,2014,5,13,2
new jobs in business analytics at monash,2014,5,4,12
business forecasting methods,2010,1,1,4
keep your business logic out of (code) jail,2021,3,4,15
maximizing the roi of your business rules investment,2020,12,3,16
4 ways to keep businesses running during a crisis,2020,5,6,16
the precondition for machine learning success: bridge the quant/business culture gap,2021,4,19,13
machine learning’s missing link: business leadership,2021,3,20,13
merging data science and business,2017,11,2,16
tally erp analytics: providing a comprehensive picture of business!,2021,6,9,9
clickless analytics is the future of business user analytics!,2021,6,8,12
digital transformation (dx) requires augmented analytics technology to support business users!,2021,6,2,11
ecommerce analytics is mandatory to business success!,2021,5,27,12
want to know your business future? get auto insights!,2021,5,25,9
free report: 2021 business at the speed of ai report,2021,4,20,14
