Title,Year,Month,Day,Hour
dimension reduction for outlier detection using dobin,2021,3,26,0
leave-one-out kernel density estimates for outlier detection,2021,2,6,0
on normalization and algorithm selection for unsupervised outlier detection,2020,2,27,0
probabilistic outlier detection and visualization of smart metre data,2017,12,13,0
probabilistic outlier detection and visualization of smart metre data,2017,6,22,0
bagplots  boxplots and outlier detection for functional data,2008,6,19,3
bagplots  boxplots and outlier detection for functional data,2008,5,15,3
